<?xml version="1.0" encoding="UTF-8" ?>
<ISO8583 xmlns="http://www.tanykoo.iso8583"
         xmlns:xsi="http://www.w3.org/2001/XMLSchema-instance"
         xsi:schemaLocation="http://www.tanykoo.iso8583 ISO8583.xsd">

    <msg id="C034">
        <head>
        </head>
        <body>
            <field fieldno="1" maxlen="31" name="ad"/>
            <field fieldno="2" maxlen="31" name="asd"/>
        </body>
    </msg>
    
    <msg id="C035">
        <head></head>
        <body>
            <field fieldno="3" maxlen="3" name="ds"/>
            <field fieldno="2" maxlen="32" name="ds"/>
        </body>
    </msg>
</ISO8583>